{
  "artifact_bindings": {
    "binding_root": "6648931368a5aec1c53c5e31c5bde8666279d978f50fe9310e1b00dfe3ce5a8b",
    "bindings": [
      {
        "artifact_binding_hash": "5c5f8a5410d16cd10b208114fa3fcbd3199f880d228fc29d98d95b21a4ca30ca",
        "declared_hash": "fde6399ac352caa54bc25f7d77f1bb8fb0c421731718feb1d23bcefe3bf5ee44",
        "hash_reproducible": true,
        "name": "certification_report",
        "payload_hash": "4a12f517abe36819cc6a13794802692520ab74cccf5310c9ceff1039f8631457",
        "present": true,
        "status": "passed",
        "target_level": "RDLLM-L186",
        "version": "rdllm-certification/v1"
      },
      {
        "artifact_binding_hash": "61bff617a1130dea74fb040f14f11a28c2824e9687262a0e09690fda081be11d",
        "declared_hash": "0019ae2656944866aa4eb6c343ace5f842e9dab1532210349b0305d3952100b5",
        "hash_reproducible": true,
        "name": "provider_attribution_card",
        "payload_hash": "8bedb8e9d9503710e47e489056faa897e011ae3c82340a06d0e7864360c1d851",
        "present": true,
        "status": "",
        "target_level": "",
        "version": "rdllm-provider-attribution-card/v1"
      },
      {
        "artifact_binding_hash": "7c4eb3ff7e3bd5cf98abb9de9b95c3908701470fe81796ccb0612ef60310b4ae",
        "declared_hash": "a669a7c49b9ccbdc94e1fe218a4b17f6129d9f6a1709f7d8315f73a1a2990647",
        "hash_reproducible": true,
        "name": "integration_profile",
        "payload_hash": "cc7f048c5cf03a9e867b6db8266a750005da3f87c3a3dea966dd5cbc46673434",
        "present": true,
        "status": "ready",
        "target_level": "",
        "version": "rdllm-integration-profile/v1"
      },
      {
        "artifact_binding_hash": "a88a8bb600d6cb0e41c1f29283f8daca33f7bd78c7540aa206dd6bc63e567252",
        "declared_hash": "fb953c8d56c4298e66d51b310387f5235a4f2a1f36b4d2c54d1b609c0092c5cd",
        "hash_reproducible": true,
        "name": "discovery_manifest",
        "payload_hash": "92ac1aea74e800d8a77c8769f04fb4972e474220c98fc226e815cc4bfbf2f76a",
        "present": true,
        "status": "ready",
        "target_level": "RDLLM-L186",
        "version": "rdllm-discovery-manifest/v1"
      },
      {
        "artifact_binding_hash": "0c992124504bf58b523ace6c1b2a25d99e36d2326dc1f420110c0603df798348",
        "declared_hash": "5aee0258ef9334d228ed70557b54462ff99ff7a9cef7403ec251e89dd95875a5",
        "hash_reproducible": true,
        "name": "universal_provider_drift_sentinel",
        "payload_hash": "f715bcd2937d4a903c9fae8d4ac44cfd9f90a119c5da48435f19519eedfef944",
        "present": true,
        "status": "ready",
        "target_level": "RDLLM-L158",
        "version": "rdllm-universal-provider-drift-sentinel/v1"
      },
      {
        "artifact_binding_hash": "5a0f0e73e20815b344a1c6602588d9b61545645b4263993ec072c3b807f29ac7",
        "declared_hash": "3f81a8ca9fd360e07b73d1ccea5107393ada720f5e8615ab5613047880735505",
        "hash_reproducible": true,
        "name": "universal_provider_adapter_harness",
        "payload_hash": "e92aa957d32891b4824dae13b900932be85c4f7850bbea6885d93accc8b45753",
        "present": true,
        "status": "ready",
        "target_level": "RDLLM-L157",
        "version": "rdllm-universal-provider-adapter-harness/v1"
      },
      {
        "artifact_binding_hash": "66325ab9b3e59e115ad8fd7035039e4e53976c81fe203a7c83300065edec47a7",
        "declared_hash": "6178a7c9a07d93c9dce222d8ab2b92e349c46de695d92a493899399157630702",
        "hash_reproducible": true,
        "name": "universal_foundation_adoption_kernel",
        "payload_hash": "9c3c6319c7fa25eaf4c5052b9c08e681027591c91c6a0e6fe49c491c23f2cc47",
        "present": true,
        "status": "ready",
        "target_level": "RDLLM-L156",
        "version": "rdllm-universal-foundation-adoption-kernel/v1"
      },
      {
        "artifact_binding_hash": "9c68e8ec8de28d2c0d1e45d25ed1cc8f5b901804c1b58496480cc34af5063ef4",
        "declared_hash": "da82de1080339b0ae418ab1a96668fd5884a6315aaaedd1dafa94c28cda22d00",
        "hash_reproducible": true,
        "name": "universal_provider_wire_protocol",
        "payload_hash": "934be226e575b368502359a5263bfbaac0ac750a3c94bd5c6518e487afdaf55c",
        "present": true,
        "status": "ready",
        "target_level": "RDLLM-L151",
        "version": "rdllm-universal-provider-wire-protocol/v1"
      },
      {
        "artifact_binding_hash": "bf91ebb7b7d15ddbc325a9eab205fbbe9cb7de0e902db4618c250c49484fd4bc",
        "declared_hash": "910caeffd4924a781852ab68582bfb795a70d03ec1b6909892a5b654d672989f",
        "hash_reproducible": true,
        "name": "universal_claim_provenance_envelope",
        "payload_hash": "16efe049fc9db678b90845b20661468a7cbd87c308ae90c44547ef2d10484f8a",
        "present": true,
        "status": "ready",
        "target_level": "RDLLM-L150",
        "version": "rdllm-universal-claim-provenance-envelope/v1"
      },
      {
        "artifact_binding_hash": "28617641a5bb74bfe6ba23bd375415b6b7f5a2ad07a85d38628c82d8a4260b2f",
        "declared_hash": "b3b43bca32a53afaeac82e9d4c404679af4b143a7e8d60f6ce4b784bd97bde37",
        "hash_reproducible": true,
        "name": "source_footer_delivery",
        "payload_hash": "d950a4b0234a8d58bad87416e7c58a72453b6a0c7e27f48a09bb0913877b77f6",
        "present": true,
        "status": "ready",
        "target_level": "RDLLM-L103",
        "version": ""
      },
      {
        "artifact_binding_hash": "28c760b4546c05f33ab6c14358b7c98c7fb1e3550676816dadfe1755fd47db07",
        "declared_hash": "726efff0a856fab31c93e9fadc3733706c966541c7d229b2efb0bb31d7bf5ffc",
        "hash_reproducible": true,
        "name": "client_attribution_enforcement",
        "payload_hash": "cb547c6635eba68b63cc23e3e9ae3a9ce621e7e04e5e9955424cfe9068c11b1f",
        "present": true,
        "status": "ready",
        "target_level": "RDLLM-L105",
        "version": ""
      },
      {
        "artifact_binding_hash": "95fc1b0afb591103c52d0dd294e06414279e9c82ca9c12a048135d73506dfae9",
        "declared_hash": "6c63ea7396d25b98923d0b8f88642b98518f15d41ae33d8d7decfaee6d505140",
        "hash_reproducible": true,
        "name": "response_envelope",
        "payload_hash": "e612860a96f85102d90778f4d1a640c244d97f187ef6a39971ea231f326b9a98",
        "present": true,
        "status": "verified",
        "target_level": "",
        "version": "rdllm-response-envelope/v1"
      },
      {
        "artifact_binding_hash": "8d1d9708f4509fcd8e710f7491e03f59fbf3c4886623ca8531f32fba3d35da3d",
        "declared_hash": "cbb0d24666577043fa9031de5ae7d022bde442aef432b4020f4f628547a61743",
        "hash_reproducible": true,
        "name": "citation_url_health",
        "payload_hash": "6065c9898e37b695872e3385f002817f5a351df0839a54ec0cc2191ed6246dc3",
        "present": true,
        "status": "ready",
        "target_level": "RDLLM-L124",
        "version": "rdllm-citation-url-health/v1"
      },
      {
        "artifact_binding_hash": "680ffd87d9f226dd547b8f680bda6eafae6b5610641e6067496a92f574359193",
        "declared_hash": "252e757a16d2c5711e88bf72fa4a8f93935efcb1b03ab6b663ebb2f0f3143a74",
        "hash_reproducible": true,
        "name": "source_freshness_audit",
        "payload_hash": "0a0900f4f056821c88555d33724c26e0591beed41ab23fc2a8ded2d14f2f2ba8",
        "present": true,
        "status": "ready",
        "target_level": "RDLLM-L116",
        "version": "rdllm-source-freshness-audit/v1"
      },
      {
        "artifact_binding_hash": "666ebc0e55e549d6cea485913ccf32baed113c98860dfff1d561310546c297db",
        "declared_hash": "000a11d94c0590dd12c403912bb1eb1e9569fd73182a6cb90170abb6a6970ece",
        "hash_reproducible": true,
        "name": "evidence_locator_manifest",
        "payload_hash": "0ce20056cd21b754f45033910d69c154dec761f45633e52d85ac7fca6c5e526d",
        "present": true,
        "status": "ready",
        "target_level": "RDLLM-L123",
        "version": "rdllm-evidence-locator-manifest/v1"
      },
      {
        "artifact_binding_hash": "c77a8db19426de32ac7903f36894d1d209ad8c542a128cd165019ebfa54194dd",
        "declared_hash": "43259a4501439a5a53494e65fdbb239e216d39544c96c364b89566dd8ca76ea2",
        "hash_reproducible": true,
        "name": "warranted_source_footer",
        "payload_hash": "2915540f0c518b1ed76c3c8a3abd8c22b6b9a6216cca5877aadf6aa0bf38db27",
        "present": true,
        "status": "ready",
        "target_level": "RDLLM-L120",
        "version": "rdllm-warranted-source-footer/v1"
      },
      {
        "artifact_binding_hash": "aae2b44de93e3299f8fb050866ab57fca150d5c93dd59e5798aba8825494bc6e",
        "declared_hash": "ca4bf6639b80b98dd0dffcf7b67855a0a9717e22ceca6576df57e0c029346974",
        "hash_reproducible": true,
        "name": "trust_registry",
        "payload_hash": "13b69e349e4e0d309d4ee9af06382b4f8e0a1328d39b33bbfd0d5ab66cb65fc0",
        "present": true,
        "status": "ready",
        "target_level": "RDLLM-L51",
        "version": "rdllm-trust-registry/v1"
      },
      {
        "artifact_binding_hash": "da39e5ce0ce58c05b494347945ba84b0e37460765630c99abbd81c2108b5a950",
        "declared_hash": "60e336943123017eceea9e444c7b529cd7ff044ce2b6d8024217b0b6bbb62a27",
        "hash_reproducible": true,
        "name": "foundation_runtime_router",
        "payload_hash": "e5e580b7bc0162694b5beae61cc84bace39af97053231074e12727b0a503b0a4",
        "present": true,
        "status": "released",
        "target_level": "RDLLM-L128",
        "version": "rdllm-foundation-runtime-router/v1"
      },
      {
        "artifact_binding_hash": "3d0171e49faad7796f1c978ef6a8ed027a4e2961acdcf3c26a7f13f193c8c4c4",
        "declared_hash": "98d71bb8ee99504b9f000419d66d7e7326dc2a4d849f8eddf9837fe17b343ef0",
        "hash_reproducible": true,
        "name": "foundation_model_deployment_attestation",
        "payload_hash": "d090f8544dc8bf7e79e15760915ea48bc1e0d1da5131b16dc506bc8c2cc223c6",
        "present": true,
        "status": "released",